<?xml version="1.0" encoding="UTF-8"?>
<xs:schema xmlns:xs="http://www.w3.org/2001/XMLSchema" elementFormDefault="qualified">
    <xs:element name="psalm">
        <xs:complexType>
            <xs:sequence>
                <xs:element maxOccurs="1" minOccurs="0" name="titles">
                    <xs:complexType>
                        <xs:sequence>
                            <xs:element name="title" maxOccurs="unbounded" minOccurs="0">
                                <xs:complexType mixed="true">
                                    <xs:sequence maxOccurs="unbounded" minOccurs="0">
                                        <xs:element name="language" maxOccurs="unbounded"
                                            minOccurs="0">
                                            <xs:complexType mixed="true">
                                                <xs:sequence>
                                                  <xs:element maxOccurs="unbounded" minOccurs="0"
                                                  name="red"/>
                                                </xs:sequence>
                                                <xs:attribute name="value"/>
                                            </xs:complexType>
                                        </xs:element>
                                        <xs:element maxOccurs="unbounded" minOccurs="0" name="red">
                                            <xs:complexType mixed="true">
                                                <xs:sequence>
                                                  <xs:element maxOccurs="unbounded" minOccurs="0"
                                                  name="i">
                                                  <xs:complexType mixed="true"/>
                                                  </xs:element>
                                                </xs:sequence>
                                            </xs:complexType>
                                        </xs:element>
                                        <xs:element maxOccurs="unbounded" minOccurs="0" name="i">
                                            <xs:complexType mixed="true"/>
                                        </xs:element>
                                        <xs:element maxOccurs="unbounded" minOccurs="0" name="note">
                                            <xs:complexType mixed="true">
                                                <xs:sequence maxOccurs="unbounded" minOccurs="0">
                                                  <xs:element maxOccurs="unbounded" minOccurs="0"
                                                  name="language">
                                                  <xs:complexType mixed="true">
                                                  <xs:sequence>
                                                  <xs:element maxOccurs="unbounded" minOccurs="0"
                                                  name="i"/>
                                                  <xs:element maxOccurs="unbounded" minOccurs="0"
                                                  name="red"/>
                                                  </xs:sequence>
                                                  <xs:attribute name="value" type="xs:string"
                                                  use="optional" default="ro"/>
                                                  </xs:complexType>
                                                  </xs:element>
                                                  <xs:element maxOccurs="unbounded" minOccurs="0"
                                                  name="i"/>
                                                </xs:sequence>
                                            </xs:complexType>
                                        </xs:element>
                                    </xs:sequence>
                                    <xs:attribute name="sigle" type="xs:string" use="required"/>
                                    <xs:attribute name="language" type="xs:string" use="optional"/>
                                </xs:complexType>
                            </xs:element>
                        </xs:sequence>
                    </xs:complexType>
                </xs:element>
                <xs:element maxOccurs="unbounded" ref="verse"/>
            </xs:sequence>
            <xs:attribute name="id" use="required">
                <xs:simpleType>
                    <xs:restriction base="xs:short">
                        <xs:minInclusive value="1"/>
                        <xs:maxInclusive value="151"/>
                    </xs:restriction>
                </xs:simpleType>
            </xs:attribute>
        </xs:complexType>
    </xs:element>
    <xs:element name="verse">
        <xs:complexType mixed="true">
            <xs:sequence>
                <xs:element maxOccurs="unbounded" name="variant">
                    <xs:complexType mixed="true">
                        <xs:sequence maxOccurs="unbounded" minOccurs="0">
                            <xs:element maxOccurs="unbounded" minOccurs="0" name="page">
                                <xs:complexType mixed="false">
                                    <xs:attribute name="pageID" type="xs:string" use="required"/>
                                </xs:complexType>
                            </xs:element>
                            <xs:element maxOccurs="unbounded" minOccurs="0" name="language">
                                <xs:complexType mixed="true">
                                    <xs:sequence maxOccurs="unbounded" minOccurs="0">
                                        <xs:element maxOccurs="unbounded" minOccurs="0" name="i"/>
                                        <xs:element maxOccurs="unbounded" minOccurs="0" name="note">
                                            <xs:complexType>
                                                <xs:sequence maxOccurs="unbounded" minOccurs="0">
                                                  <xs:element maxOccurs="unbounded" minOccurs="0"
                                                  name="language">
                                                  <xs:complexType mixed="true">
                                                  <xs:sequence>
                                                  <xs:element maxOccurs="unbounded" minOccurs="0"
                                                  name="i"/>
                                                  <xs:element maxOccurs="unbounded" minOccurs="0"
                                                  name="red"/>
                                                  </xs:sequence>
                                                  <xs:attribute name="value" type="xs:string"
                                                  use="optional" default="ro"/>
                                                  </xs:complexType>
                                                  </xs:element>
                                                  <xs:element maxOccurs="unbounded" minOccurs="0"
                                                  name="i"/>
                                                </xs:sequence>
                                            </xs:complexType>
                                        </xs:element>
                                        <xs:element maxOccurs="unbounded" minOccurs="0" name="red"/>
                                    </xs:sequence>
                                    <xs:attribute name="value" type="xs:string" use="required"/>
                                </xs:complexType>
                            </xs:element>
                            <xs:element maxOccurs="unbounded" minOccurs="0" name="notations">
                                <xs:complexType mixed="false">
                                    <xs:attribute name="value" type="xs:string" use="required"/>
                                </xs:complexType>
                            </xs:element>
                            <xs:element maxOccurs="unbounded" minOccurs="0" name="paratext">
                                <xs:complexType mixed="false">
                                    <xs:attribute name="value" type="xs:string" use="required"/>
                                </xs:complexType>
                            </xs:element>
                            <xs:element maxOccurs="unbounded" minOccurs="0" name="dot">
                                <xs:complexType mixed="false">
                                    <xs:attribute name="color" type="xs:string" use="required"/>
                                </xs:complexType>
                            </xs:element>
                        </xs:sequence>
                        <xs:attribute name="sigle" type="xs:string" use="required"/>
                    </xs:complexType>
                </xs:element>
            </xs:sequence>
            <xs:attribute name="id" use="required">
                <xs:simpleType>
                    <xs:restriction base="xs:short">
                        <xs:minInclusive value="1"/>
                        <xs:maxInclusive value="100"/>
                    </xs:restriction>
                </xs:simpleType>
            </xs:attribute>
        </xs:complexType>
    </xs:element>
</xs:schema>
